<?xml version="1.0"?>
<Schedule xmlns:xsi="http://www.w3.org/2001/XMLSchema-instance" xsi:noNamespaceSchemaLocation="scheduler-config.xsd">
  <!-- Claim Exception monitoring occurs every day at 2AM -->
  <ProcessSchedule process="ClaimException">
    <CronSchedule hours="2"/>
  </ProcessSchedule>
  <!-- User Exception monitoring occurs every day at 3AM -->
  <ProcessSchedule process="UserException">
    <CronSchedule hours="3"/>
  </ProcessSchedule>
  <!-- Group Exception monitoring occurs every day at 4AM -->
  <ProcessSchedule process="GroupException">
    <CronSchedule hours="4"/>
  </ProcessSchedule>
  <!-- Activity Escalation happens every 30 minutes -->
  <ProcessSchedule process="ActivityEsc">
    <CronSchedule minutes="0,30"/>
  </ProcessSchedule>
  <!-- Financials Escalation occurs every day at 6:05AM and 6:05PM -->
  <ProcessSchedule process="FinancialsEsc">
    <CronSchedule hours="6,18" minutes="5"/>
  </ProcessSchedule>
  <!-- BulkInvoices Escalation occurs every day at 6:35AM and 6:35PM -->
  <ProcessSchedule process="BulkInvoiceEsc">
    <CronSchedule hours="6,18" minutes="35"/>
  </ProcessSchedule>
  <!-- BulkInvoices workflow occurs every 30 minutes -->
  <ProcessSchedule process="BulkInvoiceWF">
    <CronSchedule minutes="0,30"/>
  </ProcessSchedule>
  <!-- TAccounts Escalation occurs every day at 12:01AM. This moves Checks/Payments scheduled for today
       into AwaitingSubmission status. Please refer to the documentation for more information. -->
  <ProcessSchedule process="TAccountEsc">
    <CronSchedule hours="0" minutes="1"/>
  </ProcessSchedule>
  <!-- Idle claim exception monitoring happens at noon on Sunday every week -->
  <ProcessSchedule process="IdleClaim">
    <CronSchedule dayofmonth="?" dayofweek="SUN" hours="12"/>
  </ProcessSchedule>
  <!-- Calculate stats every hour at 3 past the hour -->
  <ProcessSchedule process="Statistics">
    <CronSchedule minutes="3"/>
  </ProcessSchedule>
  <!-- Calculate dashboard stats every night at 1 am -->
  <ProcessSchedule process="DashboardStatistics">
    <CronSchedule hours="1"/>
  </ProcessSchedule>
  <!-- Workflow process executes every ten minutes unless any WorkflowType is mapped
       to the "fastinternal" handler, in which case the workflow process will execute
       once every ten seconds.  Workflow cannot advance any faster in the background
       than this schedule. -->
  <ProcessSchedule process="Workflow">
    <CronSchedule minutes="5,15,25,35,45,55"/>
  </ProcessSchedule>
  <ProcessSchedule process="PurgeProfilerData">
    <CronSchedule hours="2"/>
  </ProcessSchedule>
  <!-- Find metrics that need recalculation every night at 3:30 -->
  <ProcessSchedule process="RecalculateMetrics">
    <CronSchedule hours="3" minutes="30"/>
  </ProcessSchedule>
  <!-- Purge old messages in the claim history table at 4:30 am every Sunday -->
  <ProcessSchedule process="PurgeMessageHistory">
    <CronSchedule dayofmonth="?" dayofweek="SUN" hours="4" minutes="30"/>
  </ProcessSchedule>
  <!-- Run the first of every month after midnight-->
  <ProcessSchedule process="PurgeFailedWorkItems">
    <CronSchedule dayofmonth="1" hours="1"/>
  </ProcessSchedule>
    <!-- Upgrade encryption on snapshots at 1 am every day -->
  <ProcessSchedule process="EncryptionUpgrade">
      <CronSchedule hours="1"/>
  </ProcessSchedule>
  <!-- Find claims that are related to a catastrophe every night at 4:30 -->
  <ProcessSchedule process="CatastropheClaimFinder">
    <CronSchedule hours="4" minutes="30"/>
  </ProcessSchedule>

  <!-- New addresses searched for geocoding at 1:30 am -->
<!--
  <ProcessSchedule process="Geocode">
      <CronSchedule hours="1" minutes="30"/>
  </ProcessSchedule>
-->
  <!-- Create a new ExchangeRateSet every day at 2 am; requires IExchangeRateSetPlugin to be configured and enabled -->
<!--
  <ProcessSchedule process="ExchangeRate">
    <CronSchedule hours="2"/>
  </ProcessSchedule>
-->
  <!-- Contact Auto Sync batch process should run every day at 3 am -->
<!--
  <ProcessSchedule process="ContactAutoSync">
    <CronSchedule hours="3"/>
  </ProcessSchedule>
-->
  <!-- Enable to transmit Reviews to Contact Center; default is hourly -->
<!--
  <ProcessSchedule process="ReviewSync">
    <CronSchedule minutes="20"/>
  </ProcessSchedule>
-->
  <!-- Add claim metrics to loaded or upgraded claims that don't have them. -->
<!--
  <ProcessSchedule process="ClaimHealthCalc">
      <CronSchedule hours="0" minutes="45"/>
  </ProcessSchedule>
-->

</Schedule>
